<?xml version="1.0" encoding="UTF-8"?>
	<TestStationInstance xmlns:xsi="http://www.w3.org/2001/XMLSchema-instance" xsi:noNamespaceSchemaLocation="TestStationInstanceSchema.xsd"
	     designator="ATS#1">
		<PublicAssets>
		<!-- Restrictions for DBG version Case sensitive and no blanks in names e.g. "<Asset" --> 
		<!--The Master Reset Button removes in forward order of this file-->
		<!-- Sensors -->
			<Asset>
				<InstrumentNumber>1</InstrumentNumber>
				<InstrumentName>DSO_1</InstrumentName>
				<InstrumentDriver>AtXmlHPE1428A.dll</InstrumentDriver>
				<InstrumentAddress>
					<InstrumentQueryID>E1428A</InstrumentQueryID>
					<InstrumentTypeNumber>1</InstrumentTypeNumber>
					<ControllerType>VXI</ControllerType>
					<ControllerNumber>0</ControllerNumber>
					<PrimaryAddress>17</PrimaryAddress>
				</InstrumentAddress>
				<SimulationLevel>0</SimulationLevel>
				<DebugLevel>0</DebugLevel>
			</Asset>
			<Asset>
				<InstrumentNumber>2</InstrumentNumber>
				<InstrumentName>CNTR_1</InstrumentName>
				<InstrumentDriver>AtXmlAgE1420B.dll</InstrumentDriver>
				<InstrumentAddress>
					<InstrumentQueryID>AgE1420B</InstrumentQueryID>
					<InstrumentTypeNumber>1</InstrumentTypeNumber>
					<ControllerType>VXI</ControllerType>
					<ControllerNumber>0</ControllerNumber>
					<PrimaryAddress>18</PrimaryAddress>
				</InstrumentAddress>
				<SimulationLevel>0</SimulationLevel>
				<DebugLevel>0</DebugLevel>
			</Asset>						
			<Asset>
				<InstrumentNumber>3</InstrumentNumber>
				<InstrumentName>DMM_1</InstrumentName>
				<InstrumentDriver>AtXmlRi4152A.dll</InstrumentDriver>
				<InstrumentAddress>
					<InstrumentQueryID>Ri4112</InstrumentQueryID>
					<InstrumentTypeNumber>1</InstrumentTypeNumber>
					<ControllerType>VXI</ControllerType>
					<ControllerNumber>0</ControllerNumber>
					<PrimaryAddress>44</PrimaryAddress>
				</InstrumentAddress>
				<SimulationLevel>0</SimulationLevel>
				<DebugLevel>0</DebugLevel>
			</Asset>
			</Asset>
				<Asset>
				<InstrumentNumber>4</InstrumentNumber>
				<InstrumentName>RF_MEASAN_1</InstrumentName>
				<InstrumentDriver>AtXmlRfModAnal_B8701.dll</InstrumentDriver>
				<InstrumentAddress>
					<InstrumentQueryID>B8701</InstrumentQueryID>
					<InstrumentTypeNumber>1</InstrumentTypeNumber>
					<ControllerType>VXI</ControllerType>
					<ControllerNumber>0</ControllerNumber>
					<PrimaryAddress>27</PrimaryAddress>
				</InstrumentAddress>
				<SimulationLevel>0</SimulationLevel>
				<DebugLevel>0</DebugLevel>
			</Asset>
			<Asset>
				<InstrumentNumber>5</InstrumentNumber>
				<InstrumentName>RF_CNTR_1</InstrumentName>
				<InstrumentDriver>AtXmlRfCntr_TETS.dll</InstrumentDriver>
				<InstrumentAddress>
					<InstrumentQueryID>RF_CNTR_1</InstrumentQueryID>
					<InstrumentTypeNumber>1</InstrumentTypeNumber>
					<ControllerType>VXI</ControllerType>
					<ControllerNumber>0</ControllerNumber>
					<PrimaryAddress>25</PrimaryAddress>
				</InstrumentAddress>
				<SimulationLevel>0</SimulationLevel>
				<DebugLevel>0</DebugLevel>
			</Asset>
			<Asset>
				<InstrumentNumber>6</InstrumentNumber>
				<InstrumentName>RF_PWR_1</InstrumentName>
				<InstrumentDriver>AtXmlRf_Pwr_HPE1416A.dll</InstrumentDriver>
				<InstrumentAddress>
					<InstrumentQueryID>RF_PWR</InstrumentQueryID>
					<InstrumentTypeNumber>1</InstrumentTypeNumber>
					<ControllerType>VXI</ControllerType>
					<ControllerNumber>0</ControllerNumber>
					<PrimaryAddress>28</PrimaryAddress>
				</InstrumentAddress>
				<SimulationLevel>0</SimulationLevel>
				<DebugLevel>0</DebugLevel>
			</Asset>	
		<!-- Buses -->
			<Asset>
				<InstrumentNumber>11</InstrumentNumber>
				<InstrumentName>MIL1553_1</InstrumentName>
				<InstrumentDriver>AtXmlLE1553_5.dll</InstrumentDriver>
				<InstrumentAddress>
					<InstrumentQueryID></InstrumentQueryID>
					<InstrumentTypeNumber>1</InstrumentTypeNumber>
					<!-- The ControllerType field contains the windows "friendly" name of the adapter found in Network Places properties -->
					<!-- This name may not contain any spaces! The windows name may need to be changed to meet this requirement -->
					<ControllerType></ControllerType>
					<ControllerNumber></ControllerNumber>
					<PrimaryAddress></PrimaryAddress>
					<SecondaryAddress></SecondaryAddress>
					<SubModuleAddress></SubModuleAddress>
				</InstrumentAddress>
				<SimulationLevel>0</SimulationLevel>
				<DebugLevel>0</DebugLevel>			
			</Asset>	
			<Asset>
				<InstrumentNumber>12</InstrumentNumber>
				<InstrumentName>ETHERNET_1</InstrumentName>
				<InstrumentDriver>AtXmlSBSGigabit.dll</InstrumentDriver>
				<InstrumentAddress>
					<InstrumentQueryID>SBSGigabit</InstrumentQueryID>
					<InstrumentTypeNumber>1</InstrumentTypeNumber>
					<!-- The ControllerType field contains the windows "friendly" name of the adapter found in Network Places properties -->
					<!-- This name may not contain any spaces! The windows name may need to be changed to meet this requirement -->
					<ControllerType>Gigabit1</ControllerType>
					<ControllerNumber></ControllerNumber>
					<PrimaryAddress></PrimaryAddress>
					<SecondaryAddress></SecondaryAddress>
					<SubModuleAddress></SubModuleAddress>
				</InstrumentAddress>
				<SimulationLevel>0</SimulationLevel>
				<DebugLevel>0</DebugLevel>
				
			</Asset>	
			<Asset>
				<InstrumentNumber>13</InstrumentNumber>
				<InstrumentName>ETHERNET_2</InstrumentName>
				<InstrumentDriver>AtXmlSBSGigabit.dll</InstrumentDriver>
				<InstrumentAddress>
					<InstrumentQueryID>SBSGigabit</InstrumentQueryID>
					<InstrumentTypeNumber>1</InstrumentTypeNumber>
					<!-- The ControllerType field contains the windows "friendly" name of the adapter found in Network Places properties -->
					<!-- This name may not contain any spaces! The windows name may need to be changed to meet this requirement -->
					<ControllerType>Gigabit2</ControllerType>
					<ControllerNumber></ControllerNumber>
					<PrimaryAddress></PrimaryAddress>
					<SecondaryAddress></SecondaryAddress>
					<SubModuleAddress></SubModuleAddress>
				</InstrumentAddress>
				<SimulationLevel>0</SimulationLevel>
				<DebugLevel>0</DebugLevel>
			</Asset>
			<Asset>
				<InstrumentNumber>8</InstrumentNumber>
				<InstrumentName>COM_1</InstrumentName>
				<InstrumentDriver>AtXmlSLSerial.dll</InstrumentDriver>
				<InstrumentAddress>
					<InstrumentQueryID>SLS7404</InstrumentQueryID>
					<InstrumentTypeNumber>1</InstrumentTypeNumber>
					<ControllerType>COM</ControllerType>
					<ControllerNumber>1</ControllerNumber>
					<PrimaryAddress></PrimaryAddress>
					<SecondaryAddress></SecondaryAddress>
					<SubModuleAddress></SubModuleAddress>
				</InstrumentAddress>
				<SimulationLevel>0</SimulationLevel>
				<DebugLevel>0</DebugLevel>
			</Asset>
			<Asset>
				<InstrumentNumber>9</InstrumentNumber>
				<InstrumentName>COM_2</InstrumentName>
				<InstrumentDriver>AtXmlSLSerial.dll</InstrumentDriver>
				<InstrumentAddress>
					<InstrumentQueryID>SLS7404</InstrumentQueryID>
					<InstrumentTypeNumber>1</InstrumentTypeNumber>
					<ControllerType>COM</ControllerType>
					<ControllerNumber>2</ControllerNumber>
					<PrimaryAddress></PrimaryAddress>
					<SecondaryAddress></SecondaryAddress>
					<SubModuleAddress></SubModuleAddress>
				</InstrumentAddress>
				<SimulationLevel>0</SimulationLevel>
				<DebugLevel>0</DebugLevel>
			</Asset>
			<Asset>
				<InstrumentNumber>15</InstrumentNumber>
				<InstrumentName>COM_3</InstrumentName>
				<InstrumentDriver>AtXmlSLSerial.dll</InstrumentDriver>
				<InstrumentAddress>
					<InstrumentQueryID>SLS7404</InstrumentQueryID>
					<InstrumentTypeNumber>1</InstrumentTypeNumber>
					<ControllerType>COM</ControllerType>
					<ControllerNumber>3</ControllerNumber>
					<PrimaryAddress></PrimaryAddress>
					<SecondaryAddress></SecondaryAddress>
					<SubModuleAddress></SubModuleAddress>
				</InstrumentAddress>
				<SimulationLevel>0</SimulationLevel>
				<DebugLevel>0</DebugLevel>
			</Asset>
			<Asset>
				<InstrumentNumber>16</InstrumentNumber>
				<InstrumentName>COM_4</InstrumentName>
				<InstrumentDriver>AtXmlSLSerial.dll</InstrumentDriver>
				<InstrumentAddress>
					<InstrumentQueryID>SLS7404</InstrumentQueryID>
					<InstrumentTypeNumber>1</InstrumentTypeNumber>
					<ControllerType>COM</ControllerType>
					<ControllerNumber>4</ControllerNumber>
					<PrimaryAddress></PrimaryAddress>
					<SecondaryAddress></SecondaryAddress>
					<SubModuleAddress></SubModuleAddress>
				</InstrumentAddress>
				<SimulationLevel>0</SimulationLevel>
				<DebugLevel>0</DebugLevel>
			</Asset>
			<Asset>
				<InstrumentNumber>17</InstrumentNumber>
				<InstrumentName>COM_5</InstrumentName>
				<InstrumentDriver>AtXmlSLSerial.dll</InstrumentDriver>
				<InstrumentAddress>
					<InstrumentQueryID>SLS7404</InstrumentQueryID>
					<InstrumentTypeNumber>1</InstrumentTypeNumber>
					<ControllerType>COM</ControllerType>
					<ControllerNumber>5</ControllerNumber>
					<PrimaryAddress></PrimaryAddress>
					<SecondaryAddress></SecondaryAddress>
					<SubModuleAddress></SubModuleAddress>
				</InstrumentAddress>
				<SimulationLevel>0</SimulationLevel>
				<DebugLevel>0</DebugLevel>
			</Asset>
			<Asset>
				<InstrumentNumber>18</InstrumentNumber>
				<InstrumentName>CAN_1</InstrumentName>
				<InstrumentDriver>AtXmlCAN.dll</InstrumentDriver>
				<InstrumentAddress>
					<InstrumentQueryID>SLS7404</InstrumentQueryID>
					<InstrumentTypeNumber>1</InstrumentTypeNumber>
					<ControllerType>CAN</ControllerType>
					<ControllerNumber>1</ControllerNumber>
					<PrimaryAddress></PrimaryAddress>
					<SecondaryAddress></SecondaryAddress>
					<SubModuleAddress></SubModuleAddress>
				</InstrumentAddress>
				<SimulationLevel>0</SimulationLevel>
				<DebugLevel>0</DebugLevel>
				</PhysicalResources>
			</Asset>		
		<!-- Sources -->
			<Asset>
				<InstrumentNumber>20</InstrumentNumber>
				<InstrumentName>ARB_GEN_1</InstrumentName>
				<InstrumentDriver>AtXmlArb_AgE1445A.dll</InstrumentDriver>